tab_id,col_id,row_id,label,context,entity
table1,0,1,20,"[""Input validation is a frequently-used technique for checking potentially dangerous inputs in order to ensure that the inputs are safe for processing within the code, or when communicating with other components. When software does not validate input properly, an attacker is able to craft the input in a form that is not expected by the rest of the application. This will lead to parts of the system receiving unintended input, which may result in altered control flow, arbitrary control of a resource, or arbitrary code execution. Input validation is not the only technique for processing input, however. Other techniques attempt to transform potentially-dangerous input into something safe, such as filtering (CWE-790) - which attempts to remove dangerous inputs - or encoding/escaping (CWE-116), which attempts to ensure that the input is not misinterpreted when it is included in output to another component. Other techniques exist as well (see CWE-138 for more examples.) Input validation can be applied to: raw data - strings, numbers, parameters, file contents, etc. metadata - information about the raw data, such as headers or size Data can be simple or structured. Structured data can be composed of many nested layers, composed of combinations of metadata and raw data, with other simple or structured data. Many properties of raw data or metadata may need to be validated upon entry into the code, such as: specified quantities such as size, length, frequency, price, rate, number of operations, time, etc. implied or derived quantities, such as the actual size of a file instead of a specified size indexes, offsets, or positions into more complex data structures symbolic keys or other elements into hash tables, associative arrays, etc. well-formedness, i.e. syntactic correctness - compliance with expected syntax lexical token correctness - compliance with rules for what is treated as a token specified or derived type - the actual type of the input (or what the input appears to be) consistency - between individual data elements, between raw data and metadata, between references, etc. conformance to domain-specific rules, e.g. business logic equivalence - ensuring that equivalent inputs are treated the same authenticity, ownership, or other attestations about the input, e.g. a cryptographic signature to prove the source of the data Implied or derived properties of data must often be calculated or inferred by the code itself. Errors in deriving properties may be considered a contributing factor to improper input validation. Note that input validation has very different meanings to different people, or within different classification schemes. Caution must be used when referencing this CWE entry or mapping to it. For example, some weaknesses might involve inadvertently giving control to an attacker over an input when they should not be able to provide an input at all, but sometimes this is referred to as input validation. Finally, it is important to emphasize that the distinctions between input validation and output escaping are often blurred, and developers must be careful to understand the difference, including how input validation is not always sufficient to prevent vulnerabilities, especially when less stringent data types must be supported, such as free-form text. Consider a SQL injection scenario in which a person's last name is inserted into a query. The name O'Reilly would likely pass the validation step since it is a common last name in the English language. However, this valid name cannot be directly inserted into the database because it contains the ' apostrophe character, which would need to be escaped or otherwise transformed. In this case, removing the apostrophe might reduce the risk of SQL injection, but it would produce incorrect behavior because the wrong name would be recorded."", ""::PHASE:Architecture and Design:STRATEGY:Attack Surface Reduction:DESCRIPTION:Consider using language-theoretic security (LangSec) techniques that characterize inputs using a formal language and build recognizers for that language. This effectively requires parsing to be a distinct layer that effectively enforces a boundary between raw input and internal data representations, instead of allowing parser code to be scattered throughout the program, where it could be subject to errors or inconsistencies that create weaknesses. [REF-1109] [REF-1110] [REF-1111]::PHASE:Architecture and Design:STRATEGY:Libraries or Frameworks:DESCRIPTION:Use an input validation framework such as Struts or the OWASP ESAPI Validation API. Note that using a framework does not automatically address all input validation problems; be mindful of weaknesses that could arise from misusing the framework itself (CWE-1173).::PHASE:Architecture and Design Implementation:STRATEGY:Attack Surface Reduction:DESCRIPTION:Understand all the potential areas where untrusted inputs can enter your software: parameters or arguments, cookies, anything read from the network, environment variables, reverse DNS lookups, query results, request headers, URL components, e-mail, files, filenames, databases, and any external systems that provide data to the application. Remember that such inputs may be obtained indirectly through API calls.::PHASE:Implementation:STRATEGY:Input Validation:DESCRIPTION:Assume all input is malicious. Use an accept known good input validation strategy, i.e., use a list of acceptable inputs that strictly conform to specifications. Reject any input that does not strictly conform to specifications, or transform it into something that does. When performing input validation, consider all potentially relevant properties, including length, type of input, the full range of acceptable values, missing or extra inputs, syntax, consistency across related fields, and conformance to business rules. As an example of business rule logic, boat may be syntactically valid because it only contains alphanumeric characters, but it is not valid if the input is only expected to contain colors such as red or blue. Do not rely exclusively on looking for malicious or malformed inputs. This is likely to miss at least one undesirable input, especially if the code's environment changes. This can give attackers enough room to bypass the intended validation. However, denylists can be useful for detecting potential attacks or determining which inputs are so malformed that they should be rejected outright.:EFFECTIVENESS:High::PHASE:Architecture and Design:DESCRIPTION:For any security checks that are performed on the client side, ensure that these checks are duplicated on the server side, in order to avoid CWE-602. Attackers can bypass the client-side checks by modifying values after the checks have been performed, or by changing the client to remove the client-side checks entirely. Then, these modified values would be submitted to the server. Even though client-side checks provide minimal benefits with respect to server-side security, they are still useful. First, they can support intrusion detection. If the server receives input that should have been rejected by the client, then it may be an indication of an attack. Second, client-side error-checking can provide helpful feedback to the user about the expectations for valid input. Third, there may be a reduction in server-side processing time for accidental input errors, although this is typically a small savings.::PHASE:Implementation:DESCRIPTION:When your application combines data from multiple sources, perform the validation after the sources have been combined. The individual data elements may pass the validation step but violate the intended restrictions after they have been combined.::PHASE:Implementation:DESCRIPTION:Be especially careful to validate all input when invoking code that crosses language boundaries, such as from an interpreted language to native code. This could create an unexpected interaction between the language boundaries. Ensure that you are not violating any of the expectations of the language with which you are interfacing. For example, even though Java may not be susceptible to buffer overflows, providing a large argument in a call to native code might trigger an overflow.::PHASE:Implementation:DESCRIPTION:Directly convert your input type into the expected data type, such as using a conversion function that translates a string into a number. After converting to the expected data type, ensure that the input's values fall within the expected range of allowable values and that multi-field consistencies are maintained.::PHASE:Implementation:DESCRIPTION:Inputs should be decoded and canonicalized to the application's current internal representation before being validated (CWE-180, CWE-181). Make sure that your application does not inadvertently decode the same input twice (CWE-174). Such errors could be used to bypass allowlist schemes by introducing dangerous inputs after they have been checked. Use libraries such as the OWASP ESAPI Canonicalization control. Consider performing repeated canonicalization until your input does not change any more. This will avoid double-decoding and similar scenarios, but it might inadvertently modify inputs that are allowed to contain properly-encoded dangerous content.::PHASE:Implementation:DESCRIPTION:When exchanging data between components, ensure that both components are using the same character encoding. Ensure that the proper encoding is applied at each interface. Explicitly set the encoding you are using whenever the protocol allows you to do so.::""]",http://w3id.org/sepses/resource/cwe/applicablePlatform/CWE-20
table1,0,2,22,"['::126::64::76::78::79::', ""::PHASE:Implementation:STRATEGY:Input Validation:DESCRIPTION:Assume all input is malicious. Use an accept known good input validation strategy, i.e., use a list of acceptable inputs that strictly conform to specifications. Reject any input that does not strictly conform to specifications, or transform it into something that does. When performing input validation, consider all potentially relevant properties, including length, type of input, the full range of acceptable values, missing or extra inputs, syntax, consistency across related fields, and conformance to business rules. As an example of business rule logic, boat may be syntactically valid because it only contains alphanumeric characters, but it is not valid if the input is only expected to contain colors such as red or blue. Do not rely exclusively on looking for malicious or malformed inputs. This is likely to miss at least one undesirable input, especially if the code's environment changes. This can give attackers enough room to bypass the intended validation. However, denylists can be useful for detecting potential attacks or determining which inputs are so malformed that they should be rejected outright. When validating filenames, use stringent allowlists that limit the character set to be used. If feasible, only allow a single . character in the filename to avoid weaknesses such as CWE-23, and exclude directory separators such as / to avoid CWE-36. Use a list of allowable file extensions, which will help to avoid CWE-434. Do not rely exclusively on a filtering mechanism that removes potentially dangerous characters. This is equivalent to a denylist, which may be incomplete (CWE-184). For example, filtering / is insufficient protection if the filesystem also supports the use of as a directory separator. Another possible error could occur when the filtering is applied in a way that still produces dangerous data (CWE-182). For example, if ../ sequences are removed from the .../...// string in a sequential fashion, two instances of ../ would be removed from the original string, but the remaining characters would still form the ../ string.::PHASE:Architecture and Design:DESCRIPTION:For any security checks that are performed on the client side, ensure that these checks are duplicated on the server side, in order to avoid CWE-602. Attackers can bypass the client-side checks by modifying values after the checks have been performed, or by changing the client to remove the client-side checks entirely. Then, these modified values would be submitted to the server.::PHASE:Implementation:STRATEGY:Input Validation:DESCRIPTION:Inputs should be decoded and canonicalized to the application's current internal representation before being validated (CWE-180). Make sure that the application does not decode the same input twice (CWE-174). Such errors could be used to bypass allowlist validation schemes by introducing dangerous inputs after they have been checked. Use a built-in path canonicalization function (such as realpath() in C) that produces the canonical version of the pathname, which effectively removes .. sequences and symbolic links (CWE-23, CWE-59). This includes: realpath() in C getCanonicalPath() in Java GetFullPath() in ASP.NET realpath() or abs_path() in Perl realpath() in PHP::PHASE:Architecture and Design:STRATEGY:Libraries or Frameworks:DESCRIPTION:Use a vetted library or framework that does not allow this weakness to occur or provides constructs that make this weakness easier to avoid.::PHASE:Operation:STRATEGY:Firewall:DESCRIPTION:Use an application firewall that can detect attacks against this weakness. It can be beneficial in cases in which the code cannot be fixed (because it is controlled by a third party), as an emergency prevention measure while more comprehensive software assurance measures are applied, or to provide defense in depth.:EFFECTIVENESS:Moderate::PHASE:Architecture and Design Operation:STRATEGY:Environment Hardening:DESCRIPTION:Run your code using the lowest privileges that are required to accomplish the necessary tasks [REF-76]. If possible, create isolated accounts with limited privileges that are only used for a single task. That way, a successful attack will not immediately give the attacker access to the rest of the software or its environment. For example, database applications rarely need to run as the database administrator, especially in day-to-day operations.::PHASE:Architecture and Design:STRATEGY:Enforcement by Conversion:DESCRIPTION:When the set of acceptable objects, such as filenames or URLs, is limited or known, create a mapping from a set of fixed input values (such as numeric IDs) to the actual filenames or URLs, and reject all other inputs. For example, ID 1 could map to inbox.txt and ID 2 could map to profile.txt. Features such as the ESAPI AccessReferenceMap [REF-185] provide this capability.::PHASE:Architecture and Design Operation:STRATEGY:Sandbox or Jail:DESCRIPTION:Run the code in a jail or similar sandbox environment that enforces strict boundaries between the process and the operating system. This may effectively restrict which files can be accessed in a particular directory or which commands can be executed by the software. OS-level examples include the Unix chroot jail, AppArmor, and SELinux. In general, managed code may provide some protection. For example, java.io.FilePermission in the Java SecurityManager allows the software to specify restrictions on file operations. This may not be a feasible solution, and it only limits the impact to the operating system; the rest of the application may still be subject to compromise. Be careful to avoid CWE-243 and other weaknesses related to jails.:EFFECTIVENESS:Limited::PHASE:Architecture and Design Operation:STRATEGY:Attack Surface Reduction:DESCRIPTION:Store library, include, and utility files outside of the web document root, if possible. Otherwise, store them in a separate directory and use the web server's access control capabilities to prevent attackers from directly requesting them. One common practice is to define a fixed constant in each calling program, then check for the existence of the constant in the library/include file; if the constant does not exist, then the file was directly requested, and it can exit immediately. This significantly reduces the chance of an attacker being able to bypass any protection mechanisms that are in the base program but not in the include files. It will also reduce the attack surface.::PHASE:Implementation:DESCRIPTION:Ensure that error messages only contain minimal details that are useful to the intended audience and no one else. The messages need to strike the balance between being too cryptic (which can confuse users) or being too detailed (which may reveal more than intended). The messages should not reveal the methods that were used to determine the error. Attackers can use detailed information to refine or optimize their original attack, thereby increasing their chances of success. If errors must be captured in some detail, record them in log messages, but consider what could occur if the log messages can be viewed by attackers. Highly sensitive information such as passwords should never be saved to log files. Avoid inconsistent messaging that might accidentally tip off an attacker about internal state, such as whether a user account exists or not. In the context of path traversal, error messages which disclose path information can help attackers craft the appropriate attack strings to move through the file system hierarchy.::PHASE:Operation Implementation:STRATEGY:Environment Hardening:DESCRIPTION:When using PHP, configure the application so that it does not use register_globals. During implementation, develop the application so that it does not rely on this feature, but be wary of implementing a register_globals emulation that is subject to weaknesses such as CWE-95, CWE-621, and similar issues.::""]",http://w3id.org/sepses/resource/cwe/applicablePlatform/CWE-22
table1,0,3,59,"['::File or Directory::', 'Base']",http://w3id.org/sepses/resource/cwe/applicablePlatform/CWE-59
table1,0,4,78,"['This could allow attackers to execute unexpected, dangerous commands directly on the operating system. This weakness can lead to a vulnerability in environments in which the attacker does not have direct access to the operating system, such as in web applications. Alternately, if the weakness occurs in a privileged program, it could allow the attacker to specify commands that normally would not be accessible, or to call alternate commands with privileges that the attacker does not have. The problem is exacerbated if the compromised process does not follow the principle of least privilege, because the attacker-controlled commands may run with special system privileges that increases the amount of damage. There are at least two subtypes of OS command injection: The application intends to execute a single, fixed program that is under its own control. It intends to use externally-supplied inputs as arguments to that program. For example, the program might use system(nslookup [HOSTNAME]) to run nslookup and allow the user to supply a HOSTNAME, which is used as an argument. Attackers cannot prevent nslookup from executing. However, if the program does not remove command separators from the HOSTNAME argument, attackers could place the separators into the arguments, which allows them to execute their own program after nslookup has finished executing. The application accepts an input that it uses to fully select which program to run, as well as which commands to use. The application simply redirects this entire command to the operating system. For example, the program might use exec([COMMAND]) to execute the [COMMAND] that was supplied by the user. If the COMMAND is under attacker control, then the attacker can execute arbitrary commands or programs. If the command is being executed using functions like exec() and CreateProcess(), the attacker might not be able to combine multiple commands together in the same line. From a weakness standpoint, these variants represent distinct programmer errors. In the first variant, the programmer clearly intends that input from untrusted parties will be part of the arguments in the command to be executed. In the second variant, the programmer does not intend for the command to be accessible to any untrusted party, but the programmer probably has not accounted for alternate ways in which malicious attackers can provide input.', 'Stable']",http://w3id.org/sepses/resource/cwe/applicablePlatform/CWE-78
table1,0,5,79,"['::PHASE:Architecture and Design::PHASE:Implementation:NOTE:REALIZATION: This weakness is caused during implementation of an architectural security tactic.::', '::TERM:XSS:DESCRIPTION:A common abbreviation for Cross-Site Scripting.::TERM:HTML Injection:DESCRIPTION:Used as a synonym of stored (Type 2) XSS.::TERM:CSS:DESCRIPTION:In the early years after initial discovery of XSS, CSS was a commonly-used acronym. However, this would cause confusion with Cascading Style Sheets, so usage of this acronym has declined significantly.::']",http://w3id.org/sepses/resource/cwe/applicablePlatform/CWE-79
table1,0,6,89,"[""Improper Neutralization of Special Elements used in an SQL Command ('SQL Injection')"", 'Base']",http://w3id.org/sepses/resource/cwe/applicablePlatform/CWE-89
table1,0,7,94,"['::NATURE:ChildOf:CWE ID:74:VIEW ID:1000:ORDINAL:Primary::NATURE:ChildOf:CWE ID:74:VIEW ID:1003:ORDINAL:Primary::NATURE:ChildOf:CWE ID:913:VIEW ID:1000::', '::PHASE:Architecture and Design::PHASE:Implementation:NOTE:REALIZATION: This weakness is caused during implementation of an architectural security tactic.::']",http://w3id.org/sepses/resource/cwe/applicablePlatform/CWE-94
table1,0,8,119,"['Stable', 'Improper Restriction of Operations within the Bounds of a Memory Buffer']",http://w3id.org/sepses/resource/cwe/applicablePlatform/CWE-119
table1,0,9,134,"['The product uses a function that accepts a format string as an argument, but the format string originates from an external source.', 'When an attacker can modify an externally-controlled format string, this can lead to buffer overflows, denial of service, or data representation problems. It should be noted that in some circumstances, such as internationalization, the set of format strings is externally controlled by design. If the source of these format strings is trusted (e.g. only contained in library files that are only modifiable by the system administrator), then the external control might not itself pose a vulnerability.']",http://w3id.org/sepses/resource/cwe/applicablePlatform/CWE-134
table1,0,10,200,"['::METHOD:Automated Static Analysis - Binary or Bytecode:DESCRIPTION:According to SOAR, the following detection techniques may be useful: Cost effective for partial coverage: Bytecode Weakness Analysis - including disassembler + source code weakness analysis Inter-application Flow Analysis:EFFECTIVENESS:SOAR Partial::METHOD:Dynamic Analysis with Automated Results Interpretation:DESCRIPTION:According to SOAR, the following detection techniques may be useful: Highly cost effective: Web Application Scanner Web Services Scanner Database Scanners:EFFECTIVENESS:High::METHOD:Dynamic Analysis with Manual Results Interpretation:DESCRIPTION:According to SOAR, the following detection techniques may be useful: Cost effective for partial coverage: Fuzz Tester Framework-based Fuzzer Automated Monitored Execution Monitored Virtual Environment - run potentially malicious code in sandbox / wrapper / virtual machine, see if it does anything suspicious:EFFECTIVENESS:SOAR Partial::METHOD:Manual Static Analysis - Source Code:DESCRIPTION:According to SOAR, the following detection techniques may be useful: Highly cost effective: Manual Source Code Review (not inspections):EFFECTIVENESS:High::METHOD:Automated Static Analysis - Source Code:DESCRIPTION:According to SOAR, the following detection techniques may be useful: Highly cost effective: Context-configured Source Code Weakness Analyzer Cost effective for partial coverage: Source code Weakness Analyzer:EFFECTIVENESS:High::METHOD:Architecture or Design Review:DESCRIPTION:According to SOAR, the following detection techniques may be useful: Highly cost effective: Formal Methods / Correct-By-Construction Cost effective for partial coverage: Attack Modeling Inspection (IEEE 1028 standard) (can apply to requirements, design, source code, etc.):EFFECTIVENESS:High::', '::TERM:Information Disclosure:DESCRIPTION:This term is frequently used in vulnerability advisories to describe a consequence or technical impact, for any vulnerability that has a loss of confidentiality. Often, CWE-200 can be misused to represent the loss of confidentiality, even when the mistake - i.e., the weakness - is not directly related to the mishandling of the information itself, such as an out-of-bounds read that accesses sensitive memory contents; here, the out-of-bounds read is the primary weakness, not the disclosure of the memory. In addition, this phrase is also used frequently in policies and legal documents, but it does not refer to any disclosure of security-relevant information.::TERM:Information Leak:DESCRIPTION:This is a frequently used term, however the leak term has multiple uses within security. In some cases it deals with the accidental exposure of information from a different weakness, but in other cases (such as memory leak), this deals with improper tracking of resources, which can lead to exhaustion. As a result, CWE is actively avoiding usage of the leak term.::']",http://w3id.org/sepses/resource/cwe/applicablePlatform/CWE-200
table1,0,11,287,"['::PHASE:Architecture and Design:STRATEGY:Libraries or Frameworks:DESCRIPTION:Use an authentication framework or library such as the OWASP ESAPI Authentication feature.::', '::PHASE:Architecture and Design::PHASE:Implementation:NOTE:REALIZATION: This weakness is caused during implementation of an architectural security tactic.::']",http://w3id.org/sepses/resource/cwe/applicablePlatform/CWE-287
